"Original Text","Initial","Machine translation","Better translation","Best translation"
"厚手のクロース","","","",""
"役目を終えた朽ちた盾。
最初から身に着けていた、早く代わりを見つけた方がよいだろう。","","","",""
"なめし革のグローブ","","","",""
"ごく小さな円形の金属盾。
受け止めるではなく、受け流す事を目的として使われる。","","","",""
"胸当て","","","",""
"円形の皮張り盾。
受ける、流すのバランスが調整されている。
小型で扱いやすいため軽装を好む戦士によく使われる。","","","",""
"丸い盾","","","",""
"木の板を組み合わせて作られた粗末な盾。
立派な代物ではないが身を守ることはできる。","","","",""
"カイトシールド","","","",""
"最もオーソドックスな金属盾。
受け止める、受け流す、重量のバランスに優れ愛用者も多い。","","","",""
"魔石の盾","","","",""
"魔石を埋め込み術で強化した魔法の盾。
軽量で扱いやすく、魔法や炎などもある程度防ぐ。","","","",""
"石の円盾","","","",""
"石で作られた円盾。
ひどく重いがそれ故に受け止める能力に長けている。
","","","",""
"古代の盾","","","",""
"古い時代に使われた円盾。
魔法の力を帯びあらゆる攻撃から使用者を守る。","","","",""
"精霊の盾","","","",""
"精霊の加護を受けた小盾。
魔力を帯びた盾は軽く、強く、所持者に守護と祝福を与える。","","","",""
"守護の円盾","","","",""
"本来の灼けた円盾のあるべき姿。
古の魔法都市ルーラーの守護者に与えられたとされる。
強力な守護の魔法はあらゆる災いを防ぐ。","","","",""
"クリティカルスタブ1","","","",""
"クリティカルスタブ2","","","",""
"クリティカルスタブ3","","","",""
"ゼロポイントファイア","","","",""
"ヒールオーダー","","","",""
"ソードピアシング","","","",""
"爆裂斬","","","",""
"お兄ちゃんアタック","","","",""
